{
  "schema": 1,
  "kind": "psmatrix.windows-authoritative-matrix",
  "matrix_id": "psmatrix-2.0.0-production-ga-windows",
  "iterations": 10,
  "targets": [
    {
      "runtime_id": "windows-powershell-4.0",
      "endpoint": "../lab/windows-powershell-4.0/endpoint.json",
      "image_manifest": "../lab/windows-powershell-4.0/image-manifest.json",
      "fixture_root": "../fixtures/windows-authoritative"
    },
    {
      "runtime_id": "windows-powershell-5.0",
      "endpoint": "../lab/windows-powershell-5.0/endpoint.json",
      "image_manifest": "../lab/windows-powershell-5.0/image-manifest.json",
      "fixture_root": "../fixtures/windows-authoritative"
    },
    {
      "runtime_id": "windows-powershell-5.1",
      "endpoint": "../lab/windows-powershell-5.1/endpoint.json",
      "image_manifest": "../lab/windows-powershell-5.1/image-manifest.json",
      "fixture_root": "../fixtures/windows-authoritative"
    }
  ]
}
